{
  "specId": "cookie-tests",
  "description": "Exercises cookie save/load (env-var and file) against a local httpbin container. One ordered test so the container lifecycle wraps the cookie operations: the container is started (and waited on) in the first steps and removed in the last, and because steps within a test always run sequentially this is safe under concurrentRunners>1. Doesn't run on macOS (the runner has no Docker — ARM-based macOS doesn't support nested virtualization) or Windows (the runner only allows Windows containers).",
  "runOn": [
    {
      "browsers": [
        {
          "name": "firefox",
          "headless": true
        }
      ],
      "platforms": [
        "linux"
      ]
    }
  ],
  "tests": [
    {
      "testId": "cookie-lifecycle",
      "description": "Start httpbin in Docker, round-trip env-var and file cookies, then remove the container.",
      "steps": [
        {
          "runShell": "docker rm -f dd-httpbin 2>/dev/null || true; docker pull kennethreitz/httpbin && docker run -d --name dd-httpbin -p 8080:80 kennethreitz/httpbin"
        },
        {
          "runShell": "for i in $(seq 1 60); do curl -sf --max-time 5 http://localhost:8080/get -o /dev/null 2>/dev/null && exit 0; sleep 1; done; echo 'httpbin not ready after 60s' >&2; exit 1"
        },
        {
          "goTo": "http://localhost:8080/cookies/set/test_env_cookie/test_env_value"
        },
        {
          "saveCookie": "test_env_cookie"
        },
        {
          "goTo": "http://localhost:8080/"
        },
        {
          "loadCookie": "test_env_cookie"
        },
        {
          "goTo": "http://localhost:8080/cookies"
        },
        {
          "find": "/.*?test_env_value.*?/"
        },
        {
          "goTo": "http://localhost:8080/cookies/set/test_cookie/test_value"
        },
        {
          "saveCookie": {
            "name": "test_cookie",
            "path": "test-cookie.txt",
            "overwrite": "true"
          }
        },
        {
          "goTo": "http://localhost:8080/"
        },
        {
          "loadCookie": {
            "name": "test_cookie",
            "path": "test-cookie.txt"
          }
        },
        {
          "goTo": "http://localhost:8080/cookies"
        },
        {
          "find": "/.*?test_value.*?/"
        },
        {
          "runShell": {
            "command": "rm -f test-cookie.txt",
            "workingDirectory": "."
          }
        },
        {
          "runShell": "docker rm -f dd-httpbin"
        }
      ]
    }
  ]
}
